{
  "protocol_version": 1,
  "message_type": "requests.quiesced",
  "session_id": "sess-0001",
  "message_id": "msg-p-0040",
  "request_id": "msg-c-0040",
  "seq": 9,
  "payload": {
    "quiesce_id": "q-0001",
    "limit_scope_id": "mexc-spot-ip",
    "limit_epoch": 4,
    "resolutions": [
      {
        "permit_id": "c1d2e3f4-a5b6-4c7d-8e9f-0a1b2c3d4e5f",
        "origin_session_id": "sess-0001",
        "outcome": "COMPLETED",
        "evidence": {
          "evidence_id": "ev-0041",
          "observer_id": "companion-7f3a-run-5c2e",
          "observed_at": "2026-10-19T18:07:30Z",
          "method": "UPSTREAM_TERMINAL_OUTCOME",
          "source_execution_context_id": "companion-7f3a-run-5c2e:terminal-pid-4120-1760900000",
          "artifact_ref": "evidence:companion-7f3a-0041"
        }
      }
    ],
    "unresolved_permit_ids": ["e5f6a7b8-c9d0-4e1f-8a2b-3c4d5e6f7a8b"]
  }
}
