{
  "protocol_version": 1,
  "message_type": "requests.quiesce",
  "session_id": "sess-0001",
  "message_id": "msg-c-0040",
  "seq": 9,
  "payload": {
    "quiesce_id": "q-0001",
    "limit_scope_id": "mexc-spot-ip",
    "limit_epoch": 4,
    "permit_ids": ["c1d2e3f4-a5b6-4c7d-8e9f-0a1b2c3d4e5f", "e5f6a7b8-c9d0-4e1f-8a2b-3c4d5e6f7a8b"]
  }
}
